[
  {
    "case_id": "ecq-parse-trailing-zero",
    "category": "parse_normalization",
    "numeric_contract_version": "v1",
    "numeric_profile_id": "ECQUOTA_DECIMAL_FULL_VALUE_V1",
    "authority_scope": "qz.energy_quota:decimal-ingress",
    "inputs": {"value": "5.0000"},
    "provenance": {"central_sha": "ee5feb0cc34dbd99790500fadd0c4c932e202a20", "source": "NUMERIC_CONTRACT_V1_FROZEN.md §2"},
    "expected_reference_value": "5.0000",
    "normalized_value": "5.0000"
  },
  {
    "case_id": "ecq-reject-python-float",
    "category": "input_rejection",
    "numeric_contract_version": "v1",
    "numeric_profile_id": "ECQUOTA_DECIMAL_FULL_VALUE_V1",
    "authority_scope": "qz.energy_quota:authoritative-domain-ingress",
    "inputs": {"python_float": 5.0000004},
    "provenance": {"central_sha": "ee5feb0cc34dbd99790500fadd0c4c932e202a20", "source": "NUMERIC_CONTRACT_V1_FROZEN.md §2"},
    "expected_error": "binary float rejected"
  },
  {
    "case_id": "ecq-public-grade-round6-break",
    "category": "legacy_migration",
    "numeric_contract_version": "v1",
    "numeric_profile_id": "ECQUOTA_DECIMAL_FULL_VALUE_V1",
    "authority_scope": "qz.energy_quota:EvaluationEngine.grade",
    "inputs": {"actual": "10.0000004", "threshold": "10"},
    "provenance": {"central_sha": "ee5feb0cc34dbd99790500fadd0c4c932e202a20", "source": "Numeric v1 default full-value exact comparison"},
    "operator": "lte",
    "threshold": "10",
    "comparison_value": "10.0000004",
    "legacy_expected_result": "LEVEL_1",
    "legacy_numeric_behavior_version": "ecquota-legacy-round6-v1",
    "current_numeric_behavior_version": "ecquota-full-value-exact-v1",
    "expected_business_result": "LEVEL_2"
  },
  {
    "case_id": "ecq-public-compliance-round6-break",
    "category": "legacy_migration",
    "numeric_contract_version": "v1",
    "numeric_profile_id": "ECQUOTA_DECIMAL_FULL_VALUE_V1",
    "authority_scope": "qz.energy_quota:EvaluationEngine.compliance",
    "inputs": {"actual": "20.0000004", "limit": "20"},
    "provenance": {"central_sha": "ee5feb0cc34dbd99790500fadd0c4c932e202a20", "source": "Numeric v1 default full-value exact comparison"},
    "operator": "lte",
    "threshold": "20",
    "comparison_value": "20.0000004",
    "legacy_expected_result": "符合",
    "legacy_numeric_behavior_version": "ecquota-legacy-round6-v1",
    "current_numeric_behavior_version": "ecquota-full-value-exact-v1",
    "expected_business_result": "不符合"
  },
  {
    "case_id": "ecq-gb29446-t-minus",
    "category": "business_boundary",
    "numeric_contract_version": "v1",
    "numeric_profile_id": "ECQUOTA_DECIMAL_FULL_VALUE_V1",
    "authority_scope": "GB29446-2019:coking-coal-grade",
    "inputs": {"actual": "4.9999996"},
    "provenance": {"standard": "GB 29446-2019", "table": "表1", "limit": "1级≤5.0"},
    "operator": "lte",
    "threshold": "5.0",
    "comparison_value": "4.9999996",
    "expected_business_result": "LEVEL_1"
  },
  {
    "case_id": "ecq-gb29446-t-equal",
    "category": "business_boundary",
    "numeric_contract_version": "v1",
    "numeric_profile_id": "ECQUOTA_DECIMAL_FULL_VALUE_V1",
    "authority_scope": "GB29446-2019:coking-coal-grade",
    "inputs": {"actual": "5.0"},
    "provenance": {"standard": "GB 29446-2019", "table": "表1", "limit": "1级≤5.0"},
    "operator": "lte",
    "threshold": "5.0",
    "comparison_value": "5.0",
    "expected_business_result": "LEVEL_1"
  },
  {
    "case_id": "ecq-gb29446-t-plus",
    "category": "business_boundary",
    "numeric_contract_version": "v1",
    "numeric_profile_id": "ECQUOTA_DECIMAL_FULL_VALUE_V1",
    "authority_scope": "GB29446-2019:coking-coal-grade",
    "inputs": {"actual": "5.0000004"},
    "provenance": {"standard": "GB 29446-2019", "table": "表1", "limit": "1级≤5.0"},
    "operator": "lte",
    "threshold": "5.0",
    "comparison_value": "5.0000004",
    "expected_business_result": "LEVEL_2"
  },
  {
    "case_id": "ecq-gb29446-break-5",
    "category": "legacy_migration",
    "numeric_contract_version": "v1",
    "numeric_profile_id": "ECQUOTA_DECIMAL_FULL_VALUE_V1",
    "authority_scope": "GB29446-2019:coking-coal-grade",
    "inputs": {"actual": "5.0000004"},
    "provenance": {"standard": "GB 29446-2019", "table": "表1"},
    "legacy_expected_result": "LEVEL_1",
    "legacy_numeric_behavior_version": "ecquota-legacy-round6-v1",
    "current_numeric_behavior_version": "ecquota-gb29446-full-value-v2",
    "expected_business_result": "LEVEL_2"
  },
  {
    "case_id": "ecq-gb29446-break-7",
    "category": "legacy_migration",
    "numeric_contract_version": "v1",
    "numeric_profile_id": "ECQUOTA_DECIMAL_FULL_VALUE_V1",
    "authority_scope": "GB29446-2019:coking-coal-grade",
    "inputs": {"actual": "7.0000004"},
    "provenance": {"standard": "GB 29446-2019", "table": "表1"},
    "legacy_expected_result": "LEVEL_2",
    "legacy_numeric_behavior_version": "ecquota-legacy-round6-v1",
    "current_numeric_behavior_version": "ecquota-gb29446-full-value-v2",
    "expected_business_result": "LEVEL_3"
  },
  {
    "case_id": "ecq-gb29446-break-8_5",
    "category": "legacy_migration",
    "numeric_contract_version": "v1",
    "numeric_profile_id": "ECQUOTA_DECIMAL_FULL_VALUE_V1",
    "authority_scope": "GB29446-2019:coking-coal-grade",
    "inputs": {"actual": "8.5000004"},
    "provenance": {"standard": "GB 29446-2019", "table": "表1"},
    "legacy_expected_result": "LEVEL_3",
    "legacy_numeric_behavior_version": "ecquota-legacy-round6-v1",
    "current_numeric_behavior_version": "ecquota-gb29446-full-value-v2",
    "expected_business_result": "NOT_QUALIFIED"
  },
  {
    "case_id": "ecq-gb29446-break-2",
    "category": "legacy_migration",
    "numeric_contract_version": "v1",
    "numeric_profile_id": "ECQUOTA_DECIMAL_FULL_VALUE_V1",
    "authority_scope": "GB29446-2019:power-coal-grade",
    "inputs": {"actual": "2.0000004"},
    "provenance": {"standard": "GB 29446-2019", "table": "表2"},
    "legacy_expected_result": "LEVEL_1",
    "legacy_numeric_behavior_version": "ecquota-legacy-round6-v1",
    "current_numeric_behavior_version": "ecquota-gb29446-full-value-v2",
    "expected_business_result": "LEVEL_2"
  },
  {
    "case_id": "ecq-gb29446-break-3",
    "category": "legacy_migration",
    "numeric_contract_version": "v1",
    "numeric_profile_id": "ECQUOTA_DECIMAL_FULL_VALUE_V1",
    "authority_scope": "GB29446-2019:power-coal-grade",
    "inputs": {"actual": "3.0000004"},
    "provenance": {"standard": "GB 29446-2019", "table": "表2"},
    "legacy_expected_result": "LEVEL_2",
    "legacy_numeric_behavior_version": "ecquota-legacy-round6-v1",
    "current_numeric_behavior_version": "ecquota-gb29446-full-value-v2",
    "expected_business_result": "LEVEL_3"
  },
  {
    "case_id": "ecq-gb29446-break-4_5",
    "category": "legacy_migration",
    "numeric_contract_version": "v1",
    "numeric_profile_id": "ECQUOTA_DECIMAL_FULL_VALUE_V1",
    "authority_scope": "GB29446-2019:power-coal-grade",
    "inputs": {"actual": "4.5000004"},
    "provenance": {"standard": "GB 29446-2019", "table": "表2"},
    "legacy_expected_result": "LEVEL_3",
    "legacy_numeric_behavior_version": "ecquota-legacy-round6-v1",
    "current_numeric_behavior_version": "ecquota-gb29446-full-value-v2",
    "expected_business_result": "NOT_QUALIFIED"
  },
  {
    "case_id": "ecq-display-separation",
    "category": "display_separation",
    "numeric_contract_version": "v1",
    "numeric_profile_id": "ECQUOTA_DECIMAL_FULL_VALUE_V1",
    "authority_scope": "GB29446-2019:detail-e2e",
    "inputs": {"E_d": "50.000004", "m": "10", "k": "1.00"},
    "provenance": {"standard": "GB 29446-2019", "clause": "5.2 式(1)", "table": "表1"},
    "calculation_value": "5.0000004",
    "comparison_value": "5.0000004",
    "display_value": "5.00",
    "expected_business_result": "LEVEL_2"
  },
  {
    "case_id": "ecq-profile-propagation",
    "category": "profile_propagation",
    "numeric_contract_version": "v1",
    "numeric_profile_id": "ECQUOTA_DECIMAL_FULL_VALUE_V1",
    "authority_scope": "qz.energy_quota:EvaluationEngine",
    "inputs": {"actual": "5.0000004"},
    "provenance": {"central_sha": "ee5feb0cc34dbd99790500fadd0c4c932e202a20", "source": "NUMERIC_PROFILES_V1_FROZEN.md"},
    "requested_profile": "ECQUOTA_DECIMAL_FULL_VALUE_V1",
    "effective_profile": "ECQUOTA_DECIMAL_FULL_VALUE_V1",
    "expected_business_result": {"numeric_contract_version": "v1", "numeric_profile_id": "ECQUOTA_DECIMAL_FULL_VALUE_V1"}
  },
  {
    "case_id": "ecq-ambient-independence",
    "category": "ambient_independence",
    "numeric_contract_version": "v1",
    "numeric_profile_id": "ECQUOTA_DECIMAL_FULL_VALUE_V1",
    "authority_scope": "GB29446-2019:detail-arithmetic",
    "inputs": {"E_d": "1", "m": "3", "k": "1.00"},
    "provenance": {"central_sha": "ee5feb0cc34dbd99790500fadd0c4c932e202a20", "source": "NUMERIC_CONTRACT_V1_FROZEN.md §5"},
    "ambient_profile": {"working_precision": 6, "rounding_mode": "ROUND_UP"},
    "effective_profile": "ECQUOTA_DECIMAL_FULL_VALUE_V1",
    "expected_reference_value": "0.3333333333333333333333333333"
  }
]
